name,description,2016,2015,2014,2013,2012,2011,2010,2009,2008,2007,2006,2005,2004,2003,2002,2001,2000,1999,1998,1997,1996,1995,1994,1993,1992,1991,1990,1989,1988,1987
GOAL13_TFS,Goal: Helping to promote racial understanding,1,1,1,1,1,1,1,1,1,1,1,1,1,1,1,1,1,0,0,0,0,0,0,0,0,0,0,1,1,1
GOAL14_TFS,Goal: Improving my understanding of other countries and cultures,1,1,1,1,1,1,1,1,1,1,1,1,1,1,1,1,1,1,1,1,1,1,1,1,1,1,1,1,1,1
GOAL15_TFS,Goal: Influencing social values,1,1,1,1,1,1,1,1,1,1,1,1,1,1,1,1,1,1,1,1,1,1,1,1,1,1,1,0,0,0
GOAL16_TFS,Goal: Influencing the political structure,1,0,0,0,0,0,0,0,0,1,1,1,1,1,1,1,1,0,1,1,0,0,0,0,0,0,0,0,0,0
GOAL17_TFS,Goal: Integrating spirituality into my life,1,1,1,1,1,1,1,1,1,1,1,1,1,1,1,1,1,1,1,1,1,1,1,1,1,1,1,0,0,0
GOAL18_TFS,Goal: Keeping up to date with political affairs,1,1,1,1,1,1,1,1,1,1,1,1,1,1,1,1,1,1,1,1,1,1,1,1,1,1,1,0,0,0
GOAL19_TFS,Goal: Making a theoretical contribution to science,1,1,1,1,1,1,1,1,1,1,1,1,1,1,1,1,1,1,1,1,1,1,1,1,1,1,1,0,0,0
GOAL20_TFS,Goal: Obtaining recognition from my colleagues for contributions to my special field,1,1,1,1,1,1,1,1,1,1,1,1,1,1,1,1,1,1,1,1,1,1,1,1,1,1,1,0,0,0
GOAL21_TFS,Goal: Participating in a community action program,0,0,0,0,0,0,0,0,1,1,1,0,0,0,0,0,0,0,0,0,0,0,0,0,0,1,1,1,1,1
GOAL22_TFS,Goal: Participating in an organization like the Peace Corps or Vista,1,1,1,1,1,1,1,1,1,1,1,1,1,1,1,1,1,1,1,1,1,1,1,1,1,1,1,1,1,1
GOAL23_TFS,Goal: Raising a family,1,1,1,1,1,1,1,1,1,1,1,1,1,1,1,1,1,1,1,1,1,1,1,1,1,1,1,1,1,1
GOAL24_TFS,"Goal: Writing original works (poems, novels, etc.)",1,1,1,1,1,1,1,1,1,1,1,1,1,1,1,1,1,1,1,1,1,1,1,1,1,1,1,0,0,0
HADREM1_TFS,English: Have had special tutoring or remedial work,0,1,1,1,0,0,1,1,1,1,1,1,1,1,1,1,1,1,1,1,0,1,1,1,0,1,1,0,0,0
HADREM2_TFS,Reading: Have had special tutoring or remedial work,0,1,1,1,0,0,1,1,1,1,1,1,1,1,1,1,1,1,1,1,0,1,1,1,0,1,1,0,0,0
HADREM3_TFS,Mathematics: Have had special tutoring or remedial work,0,1,1,1,0,0,1,1,1,1,1,1,1,1,1,1,1,1,1,1,0,1,1,1,0,1,1,0,0,0
HADREM4_TFS,Social Studies: Have had special tutoring or remedial work,0,1,1,1,0,0,1,1,1,1,1,1,1,1,1,1,1,1,1,1,0,1,1,1,0,1,1,0,0,0
HADREM5_TFS,Science: Have had special tutoring or remedial work,0,1,1,1,0,0,1,1,1,1,1,1,1,1,1,1,1,1,1,1,0,1,1,1,0,1,1,0,0,0
HADREM6_TFS,Foreign Language: Have had special tutoring or remedial work,0,1,1,1,0,0,1,1,1,1,1,1,1,1,1,1,1,0,1,1,0,0,0,0,0,0,0,0,0,0
HADREM7_TFS,Writing: Have had special tutoring or remedial work,0,1,1,1,0,0,1,1,1,1,1,1,1,1,1,1,1,1,1,1,0,1,1,1,0,1,1,1,0,0
HIDEGREE_TFS,Highest academic degree planned at this college,1,1,1,1,1,1,1,1,1,1,1,1,1,1,1,1,1,1,1,1,1,1,1,1,0,1,1,0,0,0
HOMESTATE_TFS,Student's home state,0,0,0,0,1,1,1,1,1,1,1,1,1,1,1,1,1,0,1,1,0,0,1,1,0,1,1,0,0,0
HOMEZIP_TFS,Student's home zip,0,0,0,0,1,1,1,1,1,1,1,1,1,1,1,1,1,1,1,1,0,1,1,1,0,1,1,0,0,0
HPW01_T2_TFS,Hours per Week: Hobbies,0,0,0,0,0,0,0,0,0,0,0,0,0,0,0,0,0,0,0,0,0,0,0,1,0,1,1,0,0,0
HPW01_TFS,Hours per Week: Studying/homework,1,1,1,1,1,1,1,1,1,1,1,1,1,1,1,1,1,1,1,1,0,1,1,1,1,1,1,1,1,0
HPW02_TFS,Hours per Week: Socializing with friends,0,1,1,1,1,1,1,1,1,1,1,1,1,1,1,1,1,1,1,1,1,1,1,1,1,1,1,0,0,0
HPW03_TFS,Hours per Week: Talking with teachers outside of class,1,1,1,1,1,1,1,1,1,1,1,1,1,1,1,1,1,1,1,1,1,1,1,1,1,1,1,1,0,0
HPW04_TFS,Hours per Week: Exercise or sports,1,1,1,1,1,1,1,1,1,1,1,1,1,1,1,1,1,1,1,1,1,1,1,1,1,1,1,0,0,0
HPW05_TFS,Hours per Week: Partying,1,1,1,1,1,1,1,1,1,1,1,1,1,1,1,1,1,1,1,1,1,1,1,1,1,1,1,1,1,1
HPW06_TFS,Hours per Week: Working (for pay),0,1,1,1,1,1,1,1,1,1,1,1,1,1,1,1,1,1,1,1,1,1,1,1,1,1,1,1,1,1
HPW07_TFS,Hours per Week: Volunteer work,1,1,1,1,1,1,1,1,1,1,1,1,1,1,1,1,1,1,1,1,1,1,1,1,1,1,1,1,1,1
HPW08_TFS,Hours per Week: Student clubs/groups,0,1,1,1,1,1,1,1,1,1,1,1,1,1,1,1,1,1,1,1,1,1,1,1,1,1,1,1,1,1
HPW09_TFS,Hours per Week: Watching TV,1,1,1,1,1,1,1,1,1,1,1,1,1,1,1,1,1,1,1,1,1,0,1,1,0,1,1,1,1,1
HPW10_TFS,Hours per Week: Household/childcare duties,0,0,0,0,0,0,0,0,0,1,1,1,1,1,1,1,1,1,1,1,1,0,1,1,0,0,0,1,1,1
HPW11_TFS,Hours per Week: Prayer/meditation,0,1,1,1,1,1,1,1,1,1,1,1,1,1,1,1,1,1,1,1,1,0,1,1,0,1,0,1,1,1
HPW12_TFS,Hours per Week: Reading for pleasure,0,0,0,0,0,1,0,0,0,0,0,0,0,0,1,1,1,1,1,1,1,0,1,1,0,0,0,1,1,1
HPW13_TFS,Hours per Week: Played video games,0,1,1,1,1,0,1,1,1,1,1,1,1,1,1,1,1,0,1,1,0,0,0,0,0,0,0,1,1,1
HPW14_TFS,Hours per Week: Playing video/computer games,1,1,1,1,1,1,1,1,1,1,0,0,0,0,0,0,0,0,0,0,0,0,0,0,0,0,0,0,0,0
HPW15_TFS,"Hours per Week: Online social networks (MySpace, Facebook, etc.)",0,0,1,1,1,1,0,0,0,0,0,0,0,0,0,0,0,0,0,0,0,0,0,0,0,0,0,0,0,0
HSGPA_TFS,What was your average grade in high school?,0,0,0,0,0,0,1,1,1,1,1,0,0,0,0,0,0,0,0,0,0,0,0,0,0,0,0,0,0,0
HSTYPE_TFS,From what kind of high school did you graduate?,1,1,0,0,0,0,0,0,0,0,0,0,0,0,0,0,0,0,0,0,0,0,0,0,0,0,0,0,0,0
HSTYPE1_TFS,From what kind of secondary school did you graduate?,1,1,1,1,1,1,1,1,1,1,1,1,1,1,1,1,1,1,1,1,1,1,1,1,1,1,1,0,0,1
HSTYPE2_TFS,From what kind of high school did you graduate?,0,0,0,0,0,0,0,0,0,0,0,0,0,1,1,1,1,0,1,1,0,0,1,1,0,1,1,1,1,1
IMPCAFEER01_T2_TFS,Important to Career: Job openings generally available,0,0,0,0,0,0,0,0,0,0,0,0,0,0,0,0,0,0,0,0,0,0,0,1,0,1,1,0,0,0
IMPCAFEER02_T2_TFS,Important to Career: Rapid career advancement possible,0,0,0,0,0,0,0,0,0,0,0,0,0,0,0,0,0,0,0,0,0,0,0,1,0,1,1,0,0,0
IMPCAFEER03_T2_TFS,Important to Career: High anticipated earnings,0,0,0,0,0,0,0,0,0,0,0,0,0,0,0,0,0,0,0,0,0,0,0,1,0,1,1,0,0,0
IMPCAFEER04_T2_TFS,Important to Career: Well-respected/prestigious occupation,0,0,0,0,0,0,0,0,0,0,0,0,0,0,0,0,0,0,0,0,0,0,0,1,0,1,1,0,0,0
IMPCAFEER05_T2_TFS,Important to Career: Great deal of independence,0,0,0,0,0,0,0,0,0,0,0,0,0,0,0,0,0,0,0,0,0,0,0,1,0,1,1,0,0,0
IMPCAFEER06_T2_TFS,Important to Career: Chance for steady progress,0,0,0,0,0,0,0,0,0,0,0,0,0,0,0,0,0,0,0,0,0,0,0,1,0,1,1,0,0,0
IMPCAFEER07_T2_TFS,Important to Career: Can make important contribution to society,0,0,0,0,0,0,0,0,0,0,0,0,0,0,0,0,0,0,0,0,0,0,0,1,0,1,1,0,0,0
IMPCAFEER08_T2_TFS,Important to Career: Can avoid pressure,0,0,0,0,0,0,0,0,0,0,0,0,0,0,0,0,0,0,0,0,0,0,0,1,0,1,1,0,0,0
IMPCAFEER09_T2_TFS,Important to Career: Can work with ideas,0,0,0,0,0,0,0,0,0,0,0,0,0,0,0,0,0,0,0,0,0,0,0,1,0,1,1,0,0,0
IMPCAFEER10_T2_TFS,Important to Career: Can be helpful to others,0,0,0,0,0,0,0,0,0,0,0,0,0,0,0,0,0,0,0,0,0,0,0,1,0,1,1,0,0,0
IMPCAFEER11_T2_TFS,Important to Career: Able to work with people,0,0,0,0,0,0,0,0,0,0,0,0,0,0,0,0,0,0,0,0,0,0,0,1,0,1,1,0,0,0
IMPCAFEER12_T2_TFS,Important to Career: Intrinsic interest in field,0,0,0,0,0,0,0,0,0,0,0,0,0,0,0,0,0,0,0,0,0,0,0,1,0,1,1,0,0,0
IMPCAFEER13_T2_TFS,Important to Career: The work would be challenging,0,0,0,0,0,0,0,1,1,1,1,0,0,0,0,0,0,0,0,0,0,0,0,0,0,0,0,0,0,0
INCOME_TFS,Parental Income,1,1,1,1,1,1,1,1,1,1,1,1,1,1,1,1,1,1,1,1,1,1,1,1,1,1,1,0,0,0
LEGACY_T2_TFS,Did either of your parents or legal guardians attend the institution that you are now attending?,0,0,0,0,0,0,0,0,0,0,0,0,0,0,0,0,1,0,1,1,0,0,1,1,0,1,1,0,0,0
LGBTQIDEN_TFS,What is your sexual orientation?,1,1,1,0,1,0,0,0,0,0,0,0,0,0,0,0,0,0,0,0,0,0,0,0,0,0,0,1,1,1
MAJOR_TFS,Student's probable field of study/major,1,1,1,1,1,1,1,1,1,1,1,1,1,1,1,1,1,0,1,1,1,1,1,1,1,1,1,0,0,0
MAJORA_TFS,Student's aggregated major,1,1,1,1,1,1,1,1,1,1,1,1,1,1,1,1,1,0,1,1,1,1,1,1,1,1,1,0,0,0
MARITAL_TFS,Are you presently married?,1,1,1,1,1,1,1,1,1,1,1,1,1,1,1,1,1,0,1,1,0,0,1,1,0,1,1,0,0,0
MATCHLEVEL_TFS,Type of Match,1,1,1,1,1,1,1,1,1,1,1,1,0,0,0,0,0,1,0,0,0,0,0,0,0,0,0,0,0,0
MATH1_TFS,Math Courses Completed: Algebra II,1,1,1,0,1,0,0,0,0,0,0,0,0,0,0,0,0,0,0,0,0,0,0,0,0,0,0,1,1,1
MATH2_TFS,Math Courses Completed: Pre-calculus/Trigonometry,1,1,1,0,1,0,0,0,0,0,0,0,0,0,0,0,0,0,0,0,0,0,0,0,0,0,0,0,0,0
MATH3_TFS,Math Courses Completed: Probability and Statistics,1,1,1,0,1,0,0,0,0,0,0,0,0,0,0,0,0,0,0,0,0,0,0,0,0,0,0,0,0,0
MATH4_TFS,Math Courses Completed: Calculus,1,1,1,0,1,0,0,0,0,0,0,0,0,0,0,0,0,0,0,0,0,0,0,0,0,0,0,0,0,0
MATH5_TFS,Math Courses Completed: AP Probability and Statistics,1,1,1,0,1,0,0,0,0,0,0,0,0,0,0,0,0,0,0,0,0,0,0,0,0,0,0,0,0,0
MATH6_TFS,Math Courses Completed: AP Calculus,1,1,1,0,1,1,0,0,0,0,0,0,0,0,0,0,0,0,0,0,0,0,0,0,0,0,0,1,1,1
MCAREER_TFS,Mother's career,1,1,1,1,1,1,1,1,1,1,1,1,1,1,1,1,1,0,1,1,1,1,1,1,1,1,1,0,0,0
MCAREERA_TFS,Father's aggregated career,1,1,1,1,1,1,1,1,1,1,1,1,1,1,1,1,1,0,1,1,1,1,1,1,1,1,1,0,0,0
MEMPLOY_TFS,Mother's Employment Status,1,1,1,0,0,0,0,0,0,0,0,0,0,0,0,0,0,0,0,0,0,0,0,0,0,0,0,0,0,0
MILITARY_TFS,Military Status:,1,0,0,0,0,0,0,0,0,0,0,0,0,0,0,0,0,0,0,0,0,0,0,0,0,0,0,0,0,0
MNDHAB01_TFS,Habits of Mind: Ask questions in class,1,1,1,1,1,1,1,1,1,1,0,0,0,0,0,0,0,0,0,0,0,0,0,0,0,0,0,0,0,0
MNDHAB02_TFS,Habits of Mind: Support your opinions with a logical argument,1,1,1,1,1,1,1,1,1,1,0,0,0,0,0,0,0,0,0,0,0,0,0,0,0,0,0,0,0,0
MNDHAB03_TFS,Habits of Mind: Seek solutions to problems and explain them to others,0,1,1,1,1,1,1,1,1,1,0,0,0,0,0,0,0,0,0,0,0,0,0,0,0,0,0,0,0,0
MNDHAB04_TFS,Habits of Mind: Revise your papers to improve your writing,1,1,1,1,1,1,1,1,1,1,0,0,0,0,0,0,0,0,0,0,0,0,0,0,0,0,0,0,0,0
MNDHAB05_TFS,Habits of Mind: Evaluate the quality or reliability of information you received,1,1,1,1,1,1,1,1,1,1,0,0,0,0,0,0,0,0,0,0,0,0,0,0,0,0,0,0,0,0
MNDHAB06_TFS,Habits of Mind: Take a risk because you felt you had more to gain,1,1,1,1,1,1,1,1,1,1,0,0,0,0,0,0,0,0,0,0,0,0,0,0,0,0,0,0,0,0
MNDHAB07_TFS,Habits of Mind: Seek alternative solutions to a problem,1,1,1,1,1,1,1,1,1,1,0,0,0,0,0,0,0,0,0,0,0,0,0,0,0,0,0,0,0,0
MNDHAB08_TFS,Habits of Mind: Look up scientific research articles and resources,1,1,1,1,1,1,1,1,1,1,0,0,0,0,0,0,0,0,0,0,0,0,0,0,0,0,0,0,0,0
MNDHAB09_TFS,"Habits of Mind: Explore topics on your own, even though it was not required for a class",1,1,1,1,1,1,1,1,1,0,0,0,0,0,0,0,0,0,0,0,0,0,0,0,0,0,0,0,0,0
MNDHAB10_TFS,Habits of Mind: Accept mistakes as part of the learning process,0,1,1,1,1,1,1,1,1,1,0,0,0,0,0,0,0,0,0,0,0,0,0,0,0,0,0,0,0,0
MNDHAB11_TFS,Habits of Mind: Seek feedback on your academic work,0,0,0,0,1,1,1,1,1,0,0,0,0,0,0,0,0,0,0,0,0,0,0,0,0,0,0,0,0,0
MNDHAB12_TFS,Habits of Mind: Take notes during class,0,0,1,1,1,1,1,0,0,0,0,0,0,0,0,0,0,0,0,0,0,0,0,0,0,0,0,1,1,1
MNDHAB13_TFS,Habits of Mind: Work with other students on group projects,0,0,1,1,1,1,1,0,0,0,0,0,0,0,0,0,0,0,0,0,0,0,0,0,0,0,0,0,1,0
MNDHAB14_TFS,Habits of Mind: Integrate skills and knowledge from different sources and experiences,1,1,1,1,1,1,1,1,1,1,1,0,0,0,0,0,0,0,0,0,0,0,0,0,0,0,0,0,1,0
MNDHAB15_TFS,Habits of Mind: Analyze multiple sources of information before coming to a conclusion,1,0,0,0,0,0,0,0,0,0,0,0,0,0,0,0,0,0,0,0,0,0,0,0,0,0,0,0,0,0
MNDHAB16_TFS,Habits of Mind: Take on a challenge that scares you,0,0,0,0,0,0,0,0,0,0,0,0,0,0,0,0,0,0,0,0,0,0,1,1,0,1,1,0,0,0
MOTHEDUC_TFS,Mother's education,1,1,1,1,1,1,1,1,1,1,1,1,1,1,1,1,1,1,1,1,1,1,1,1,1,1,1,0,0,0
MRELIGION_TFS,Mother's religion,1,1,1,1,1,1,1,1,1,1,1,1,1,1,1,1,1,1,1,1,1,1,1,1,1,1,1,0,0,0
MRELIGIONA_TFS,Your mother's religious preference,1,0,0,0,0,0,0,0,1,1,1,0,0,0,0,0,1,0,1,1,1,0,1,1,0,0,1,1,1,1
NATENGSP_TFS,Is English your native language?,0,0,0,0,0,0,0,0,0,0,0,0,0,1,1,1,1,0,1,1,0,0,1,1,0,1,1,0,0,0
NDEPCOL_TFS,How many of these dependents other than yourself are currently attending college?,0,0,0,0,0,0,1,1,0,0,0,0,0,0,0,0,0,0,0,0,0,0,1,1,1,1,1,1,1,1
NDEPPAR_TFS,How many persons are currently dependent on your parents for support?,0,0,0,0,0,0,0,0,0,0,0,0,0,0,0,0,0,0,0,0,0,0,0,0,0,0,1,1,1,1
NEEDREM1_TFS,English: Will need special tutoring or remedial work,0,1,1,1,0,0,1,1,1,1,1,1,1,1,1,1,1,1,1,1,0,1,1,1,0,1,1,1,0,0
NEEDREM2_TFS,Reading: Will need special tutoring or remedial work,0,1,1,1,0,0,1,1,1,1,1,1,1,1,1,1,1,1,1,1,0,1,1,1,0,1,1,1,0,0
NEEDREM3_TFS,Mathematics: Will need special tutoring or remedial work,0,1,1,1,0,0,1,1,1,1,1,1,1,1,1,1,1,1,1,1,0,1,1,1,0,1,1,1,0,0
NEEDREM4_TFS,Social Studies: Will need special tutoring or remedial work,0,1,1,1,0,0,1,1,1,1,1,1,1,1,1,1,1,1,1,1,0,1,1,1,0,1,1,1,0,0
NEEDREM5_TFS,Science: Will need special tutoring or remedial work,0,1,1,1,0,0,1,1,1,1,1,1,1,1,1,1,1,1,1,1,0,1,1,1,0,1,1,1,0,0
NEEDREM6_TFS,Foreign Language: Will need special tutoring or remedial work,0,1,1,1,0,0,1,1,1,1,1,1,1,1,1,1,1,0,1,1,0,0,0,0,0,0,0,1,0,0
NEEDREM7_TFS,Writing: Will need special tutoring or remedial work,1,1,1,1,1,1,1,1,1,1,1,1,1,1,1,1,1,1,1,1,1,1,1,1,1,1,1,1,0,0
NOCRED1_TFS,Not for credit at any other institution,0,0,0,0,0,0,0,0,0,0,0,1,1,1,1,1,1,1,1,1,0,1,1,1,1,1,1,0,0,0
NOCRED2_TFS,Not for credit at junior college or community college,0,0,0,0,0,0,0,0,0,0,0,1,1,1,1,1,1,1,1,1,0,1,1,1,1,1,1,0,0,0
NOCRED3_TFS,Not for credit at a four-year college or university,0,0,0,0,0,0,0,0,0,0,0,1,1,1,1,1,1,1,1,1,0,1,1,1,1,1,1,0,0,0
NOCRED4_TFS,Not for credit at some other postsecondary,1,1,1,1,1,1,1,1,1,1,1,1,0,0,1,0,0,0,0,0,0,0,0,0,0,0,0,0,0,0
NUMACCPT_TFS,How many other acceptances did you receive this year?,0,0,0,0,0,0,1,1,1,0,0,0,0,0,0,1,1,0,1,1,1,1,1,1,0,1,1,0,0,0
NUMAPPLY_TFS,To how many colleges other than this one did you apply for admission this year?,1,1,1,1,1,1,1,1,1,1,1,1,1,1,1,1,1,1,1,1,1,1,1,1,1,1,1,0,0,0
OTHRCOLL_TFS,"Since leaving high school, have you ever taken courses, whether for credit or not for credit, at any other institution (university, 4- or 2-year college, technical, vocational, or business school)?",1,0,0,0,0,0,0,0,0,0,0,0,0,0,0,0,0,0,0,0,0,0,0,0,0,0,0,0,0,0
PARBORN_TFS,Which of your parents were born in the U.S.?,1,1,1,1,1,1,1,1,1,1,1,1,1,1,1,1,1,1,1,1,1,1,1,1,1,1,1,1,1,1
PAREDUC1_TFS,Parent/Guardian 1 Education,1,0,0,0,0,0,0,0,0,0,0,0,0,0,0,0,0,0,0,0,0,0,0,0,0,0,0,0,0,0
PAREDUC2_TFS,Parent/Guardian 2 Education,1,1,0,0,0,0,0,0,0,0,0,0,0,0,0,0,0,0,0,0,0,0,0,0,0,0,0,0,0,0
PARSEX1_TFS,Parent/Guardian 1,1,1,0,0,0,0,0,0,0,0,0,0,0,0,0,0,0,0,0,0,0,0,0,0,0,0,0,0,0,0
PARSEX2_TFS,Parent/Guardian 2,0,0,0,0,0,0,0,0,0,0,0,0,0,0,0,0,0,0,0,0,0,0,0,0,0,0,0,0,0,0
PARSTAT_TFS,Are your parents alive? divorced?,1,1,1,1,1,1,1,1,1,1,1,1,1,1,1,1,1,1,1,1,1,1,1,1,1,1,1,1,1,0
PCAREER1_TFS,Parent/Guardian 1 Career,1,0,0,0,0,0,0,0,0,0,0,0,0,0,0,0,0,0,0,0,0,0,0,0,0,0,0,0,0,0
PCAREER2_TFS,Parent/Guardian 2 Career,1,0,0,0,0,0,0,0,0,0,0,0,0,0,0,0,0,0,0,0,0,0,0,0,0,0,0,0,0,0
PEMPLOY1_TFS,Current employment status: Parent/Guardian 1,0,0,0,0,0,0,0,0,0,0,0,0,0,0,0,0,0,0,0,0,0,0,0,0,0,0,0,0,0,0
PEMPLOY2_TFS,Current employment status: Parent/Guardian 2,1,1,1,1,1,1,1,1,1,1,1,1,1,1,1,1,1,1,1,1,1,1,1,1,1,1,1,0,0,0
PLACEENG_TFS,English,0,1,1,0,0,0,0,0,0,0,0,0,0,0,0,0,0,0,0,0,0,0,0,0,0,0,0,0,0,0
PLACEMATH_TFS,Mathematics,0,1,1,0,0,0,0,0,0,0,0,0,0,0,0,0,0,0,0,0,0,0,0,0,0,0,0,0,0,0
PLACEREAD_TFS,Reading,0,1,1,0,0,0,0,0,0,0,0,0,0,0,0,0,0,0,0,0,0,0,0,0,0,0,0,0,0,0
PLACEWRIT_TFS,Writing,0,1,1,0,0,0,0,0,0,0,0,0,0,0,0,0,0,0,0,0,0,0,0,0,0,0,0,0,0,0
PLANCOL1_T2_TFS,Planning for College: Seek high school counselor's advice,0,0,0,0,0,0,0,0,0,0,0,0,0,0,0,0,1,0,1,1,0,0,1,1,0,1,1,0,0,0
PLANCOL2_T2_TFS,Planning for College: Hired a private college counselor,0,0,0,0,0,0,0,0,0,0,0,0,0,0,0,0,1,0,1,1,0,0,1,1,0,1,1,0,0,0
PLANCOL3_T2_TFS,Planning for College: Take a SAT/ACT preparation course,0,0,0,0,0,0,0,0,0,0,0,0,0,0,0,0,0,0,0,0,0,0,0,0,0,1,1,0,0,0
PLANLIVE_TFS,Where do you plan to live during the fall term?,1,1,1,1,1,1,1,1,1,1,1,1,1,1,1,1,1,1,1,1,1,1,1,1,1,1,1,0,0,0
POLIVIEW_TFS,How would you characterize your political views?,0,0,0,0,0,0,0,0,0,0,0,0,0,0,0,0,0,0,0,0,0,0,0,0,0,1,1,0,0,0
PREFLIVE_TFS,"If you had a choice, where would you have preferred to live?",1,1,1,0,1,0,0,0,0,0,0,0,0,0,0,0,0,0,0,0,0,0,0,0,0,0,0,0,0,0
PRELAW_TFS,Do you consider yourself Pre-Law?,1,1,1,0,1,0,0,0,0,0,0,0,0,0,0,0,0,0,0,0,0,0,0,0,0,0,0,0,0,0
PRELIG1_TFS,Parent/Guardian 1 religion,1,0,0,0,0,0,0,0,0,0,0,0,0,0,0,0,0,0,0,0,0,0,0,0,0,0,0,0,0,0
PRELIG2_TFS,Parent/Guardian 2 Religion,1,0,0,0,0,0,0,0,0,0,0,0,0,0,0,0,0,0,0,0,0,0,0,0,0,0,0,0,0,0
PREMED_TFS,Do you consider yourself Pre-Med?,1,1,1,1,1,1,1,1,1,1,1,1,1,1,1,1,1,1,1,1,1,1,1,1,1,1,1,0,0,0
PREVCRED_TFS,"Prior to this term, have you ever taken courses at any other institution?",1,1,1,1,1,1,1,1,1,1,1,1,1,1,1,1,1,1,1,1,1,1,1,1,1,1,1,0,0,0
RACE1_TFS,American Indian,1,0,0,0,1,1,1,1,1,1,1,1,1,1,1,1,1,1,1,1,1,1,1,1,1,1,1,1,1,1
RACE10_TFS,"East Asian (e.g., Chinese, Japanese, Korean, Taiwanese)",1,1,0,0,1,1,1,1,1,1,1,1,1,1,1,1,1,1,1,1,1,1,1,1,1,1,1,1,1,1
RACE11_TFS,Filipino,1,1,0,0,0,0,0,0,0,0,0,0,0,0,0,0,0,0,0,0,0,0,0,0,0,0,0,0,0,0
RACE12_TFS,"Southeast Asian (e.g., Cambodian, Vietnamese, Hmong)",1,1,0,0,0,0,0,0,0,0,0,0,0,0,0,0,0,0,0,0,0,0,0,0,0,0,0,0,0,0
RACE13_TFS,"South Asian (e.g., Indian, Pakistani, Nepalese, Sri Lankan)",1,1,1,0,0,0,0,0,0,0,0,0,0,0,0,0,0,0,0,0,0,0,0,0,0,0,0,0,0,0
RACE14_TFS,Other Asian,0,1,1,0,0,0,0,0,0,0,0,0,0,0,0,0,0,0,0,0,0,0,0,0,0,0,0,0,0,0
RACE2_TFS,Asian,1,1,1,1,1,1,1,1,1,1,1,1,1,1,1,1,1,0,1,0,0,0,0,0,0,0,0,1,1,1
RACE3_TFS,Native Hawaiian/Pacific Islander,1,1,1,1,1,1,1,1,1,1,1,1,1,1,1,1,1,1,1,1,1,1,1,1,1,1,1,1,1,1
RACE4_TFS,Black,1,1,1,1,1,1,1,1,1,1,1,1,1,1,1,1,1,1,1,1,1,1,1,1,1,1,1,1,1,1
RACE5_TFS,Mexican/Chicano,1,1,0,0,1,1,1,1,1,1,1,1,1,1,1,1,1,1,1,1,1,1,1,1,1,1,1,0,0,0
RACE6_TFS,Puerto Rican,1,1,0,0,1,1,1,1,1,1,1,1,1,1,1,1,1,1,1,1,1,1,1,1,1,1,1,1,1,1
RACE7_TFS,Other Latino,1,1,0,0,1,1,1,1,1,1,1,1,1,1,1,1,1,1,1,1,1,1,1,1,1,1,1,1,1,1
RACE8_TFS,White,1,1,0,0,1,1,1,1,1,1,1,1,1,1,1,1,1,1,1,1,1,1,1,1,1,1,1,1,1,1
RACE9_TFS,Other race/ethnicity,1,1,1,0,0,0,0,0,0,0,0,0,0,0,0,0,0,0,0,0,0,0,0,0,0,0,0,0,0,0
RACEGROUP_TFS,Race/Ethnicity Group,1,1,1,1,1,1,1,1,1,1,1,1,1,1,1,1,1,1,1,1,1,1,1,1,1,1,1,0,0,0
RACEHS_TFS,How would you describe the racial composition of the high school you last attended?,0,1,1,1,1,1,1,1,1,1,1,0,0,0,0,0,0,0,0,0,0,0,0,1,0,1,1,0,0,0
RACENEIB_TFS,How would you describe the racial composition of the neighborhood where you grew up?,0,0,1,0,0,0,1,1,1,1,1,1,1,1,1,1,1,0,1,1,1,0,1,1,1,1,1,1,1,1
RATE01_TFS,Self Rating: Academic ability,1,1,1,1,1,1,1,1,1,1,1,1,1,1,1,1,1,1,1,1,1,1,1,1,1,1,1,0,0,0
RATE02_TFS,Self Rating: Artistic ability,0,0,0,0,0,0,0,0,0,0,0,0,0,0,0,1,1,0,1,1,0,0,0,0,0,0,0,0,0,0
RATE03_TFS,Self Rating: Athletic ability,0,1,1,1,1,1,1,1,1,1,0,0,0,1,1,1,1,1,1,1,1,1,1,1,1,1,1,0,0,0
RATE04_TFS,Self Rating: Competitiveness,0,1,1,1,1,1,1,1,1,1,1,1,1,1,1,1,1,0,1,1,0,0,0,0,0,0,0,0,0,0
RATE05_TFS,Self Rating: Computer skills,0,1,1,1,1,1,1,1,1,1,1,1,1,1,1,1,1,1,1,1,1,1,1,1,1,1,1,0,0,0
RATE06_TFS,Self Rating: Cooperativeness,1,1,1,1,1,1,1,1,1,1,1,1,1,1,1,1,1,1,1,1,1,0,1,1,0,1,1,0,0,0
RATE07_TFS,Self Rating: Creativity,1,1,1,1,1,1,1,1,1,1,1,1,1,1,1,1,1,1,1,1,1,1,1,1,1,1,1,0,0,0
RATE08_TFS,Self Rating: Drive to achieve,1,1,1,1,1,1,1,1,1,1,1,1,1,1,1,1,1,1,1,1,1,1,1,1,1,1,1,0,0,0
RATE09_TFS,Self Rating: Emotional health,1,1,1,1,1,1,1,1,1,1,1,1,1,1,1,1,1,1,1,1,1,1,1,1,1,1,1,0,0,0
RATE10_TFS,Self Rating: Leadership ability,1,1,1,1,1,1,1,1,1,1,1,1,1,1,1,1,1,1,1,1,1,1,1,1,1,1,1,0,0,0
RATE11_TFS,Self Rating: Mathematical ability,1,1,1,1,1,1,1,1,1,1,1,1,1,1,1,1,1,1,1,1,1,1,1,1,1,1,1,0,0,0
RATE12_TFS,Self Rating: Physical health,0,0,1,1,1,1,1,1,1,0,0,1,1,1,1,1,1,1,1,1,1,1,1,1,1,1,1,0,0,0
RATE13_TFS,Self Rating: Popularity,1,1,1,1,1,1,1,1,1,1,1,1,1,1,1,1,1,1,1,1,1,1,1,1,1,1,1,0,0,0
RATE14_TFS,Self Rating: Public speaking ability,1,1,1,1,1,1,1,1,1,1,1,1,1,1,1,1,1,1,1,1,1,1,1,1,1,1,1,0,0,0
RATE15_TFS,Self Rating: Self-confidence (intellectual),1,1,1,1,1,1,1,1,1,1,1,1,1,1,1,1,1,1,1,1,1,1,1,1,1,1,1,0,0,0
RATE16_TFS,Self Rating: Self-confidence (social),0,1,1,1,1,1,1,1,1,1,1,1,1,1,1,1,1,1,1,1,1,0,1,1,0,0,0,0,0,1
RATE17_TFS,Self Rating: Self-understanding,1,1,1,1,1,1,1,1,1,1,1,1,1,1,1,1,1,1,1,1,1,0,1,1,0,0,0,0,0,1
RATE18_TFS,Self Rating: Spirituality,1,1,1,1,1,1,1,1,1,1,1,1,1,1,1,1,1,1,1,1,1,1,1,1,1,1,1,0,0,1
RATE19_TFS,Self Rating: Understanding of others,1,1,1,1,1,1,1,1,1,1,1,1,1,1,1,1,1,1,1,1,1,1,1,1,1,1,1,0,0,1
RATE20_TFS,Self Rating: Writing ability,1,0,0,0,0,0,0,0,0,0,0,0,0,0,0,0,0,0,0,0,0,0,0,0,0,0,0,0,0,1
RATE21_TFS,Self Rating: Risk-taking,1,0,0,0,0,0,0,0,0,0,0,0,0,0,0,0,0,0,0,0,0,0,0,0,0,0,0,0,0,1
RATE23_TFS,Self Raing: Risk-taking,0,0,0,0,0,1,0,0,1,1,1,1,1,1,1,1,1,1,1,1,1,0,1,1,0,1,1,0,0,1
REASON01_TFS,Reason Attend: A mentor/role model encouraged me to go,0,0,0,0,0,1,0,0,1,1,1,1,1,1,1,1,1,1,1,1,1,1,1,1,1,1,1,0,0,1
REASON02_TFS,Reason Attend: I could not find a job,0,0,0,0,0,1,1,1,1,1,1,1,1,1,1,1,1,1,1,1,1,1,1,1,1,1,1,0,0,1
REASON03_TFS,Reason Attend: My parents wanted me to go,0,0,0,0,0,1,0,0,1,1,1,1,1,1,1,1,1,1,1,1,1,1,1,1,1,1,1,0,0,1
REASON04_TFS,Reason Attend: There was nothing better to do,1,1,1,1,1,1,1,1,1,1,1,1,1,1,1,1,1,1,1,1,1,1,1,1,1,1,1,0,0,1
REASON05_TFS,Reason Attend: To be able to get a better job,1,1,1,1,1,1,1,1,1,1,1,1,1,1,1,1,1,1,1,1,1,1,1,1,1,1,1,0,0,1
REASON06_TFS,Reason Attend: To be able to make more money,1,1,1,1,1,1,1,0,1,1,1,1,1,1,1,1,1,0,1,1,0,0,0,0,0,0,0,0,0,1
REASON07_TFS,Reason Attend: To get training for a specific career,1,1,1,1,1,0,1,1,1,1,1,1,1,1,1,1,1,1,1,1,1,1,1,1,1,1,1,0,0,1
REASON08_TFS,Reason Attend: To gain a general education and appreciation of ideas,0,0,0,0,0,0,0,0,0,0,0,1,1,1,1,1,1,1,1,1,1,1,1,1,1,1,1,0,0,1
REASON09_TFS,Reason Attend: To improve my reading and study skills,1,1,1,1,1,0,1,1,1,1,1,1,1,1,1,1,1,1,1,1,1,1,1,1,1,1,1,0,0,0
REASON10_TFS,Reason Attend: To learn more about things that interest me,1,1,1,1,1,0,1,1,1,1,1,1,1,1,1,1,1,1,1,1,1,1,1,1,1,1,1,1,0,0
REASON11_TFS,Reason Attend: To make me a more cultured person,1,1,1,1,1,0,1,0,1,1,1,1,1,1,1,1,1,1,1,1,0,0,1,1,1,1,1,1,0,0
REASON12_TFS,Reason Attend: To prepare myself for graduate or professional school,0,0,0,0,0,0,0,0,1,1,1,1,1,1,1,1,1,1,1,1,1,1,1,1,1,1,1,1,1,1
REASON13_TFS,Reason Attend: Wanted to get away from home,1,0,0,0,0,0,0,0,0,0,0,0,0,0,0,0,0,0,0,0,0,0,0,0,0,0,0,1,0,0
REASON14_TFS,Reason Attend: To please my family,1,0,0,0,0,0,0,0,0,0,0,0,0,0,0,0,0,0,0,0,0,0,0,0,0,0,0,1,1,1
RRACE_TFS,Responded to race,0,0,0,0,0,0,0,0,0,0,0,0,0,0,0,0,1,0,1,1,0,0,1,0,0,0,0,1,1,1
SCAREER_TFS,Student's probable career,1,1,1,1,1,1,1,1,1,1,1,1,1,1,1,1,1,0,1,1,1,1,1,1,1,1,1,0,0,0
SCAREERA_TFS,Student's aggregated career,1,1,1,1,1,1,1,1,1,1,1,1,1,1,1,1,1,0,1,1,1,1,1,1,1,1,1,0,0,0
SCIASSOC01_TFS,I have a strong sense of belonging to a community of scientists,1,0,0,0,0,0,0,0,0,0,0,0,0,0,0,0,0,0,0,0,0,0,0,0,0,0,0,1,1,1
SCIASSOC02_TFS,I derive great personal satisfaction from working on a team that is doing important research,1,0,0,0,0,0,0,0,0,0,0,0,0,0,0,0,0,0,0,0,0,0,0,0,0,0,0,0,0,0
SCIASSOC03_TFS,I think of myself as a scientist,1,0,0,0,0,0,0,0,0,0,0,0,0,0,0,0,0,0,0,0,0,0,0,0,0,0,0,1,1,1
SCIASSOC04_TFS,I feel like I belong in the field of science,1,0,0,0,0,0,0,0,0,0,0,0,0,0,0,0,0,0,0,0,0,0,0,0,0,0,0,1,1,1
SCICAREER_TFS,Will you pursue a science-related research career?,1,0,0,0,0,0,0,0,0,0,0,0,0,0,0,0,0,0,0,0,0,0,0,0,0,0,0,1,1,1
SCISKILLS01_TFS,"Science Skill: Use technical science skills (use of tools, instruments, and/or techniques)",1,0,0,0,0,0,0,0,0,0,0,0,0,0,0,0,0,0,0,0,0,0,0,0,0,0,0,1,1,1
SCISKILLS02_TFS,Science Skill: Generate a research question,1,0,0,0,0,0,0,0,0,0,0,0,0,0,0,0,0,0,0,0,0,0,0,0,0,0,0,1,0,0
SCISKILLS03_TFS,Science Skill: Determine how to collect appropriate data,1,0,0,0,0,0,0,0,0,0,0,0,0,0,0,0,0,0,0,0,0,0,0,0,0,0,0,0,1,1
SCISKILLS04_TFS,Science Skill: Explain the results of a study,1,0,0,0,0,0,0,0,0,0,0,0,0,0,0,0,0,0,0,0,0,0,0,0,0,0,0,0,1,1
SCISKILLS05_TFS,Science Skill: Use scientific literature to guide research,1,0,0,0,0,0,0,0,0,0,0,0,0,0,0,0,0,0,0,0,0,0,0,0,0,0,0,0,1,1
SCISKILLS06_TFS,Science Skill: Integrate results from multiple studies,1,0,0,0,0,0,0,0,0,0,0,0,0,0,0,0,0,0,0,0,0,0,0,0,0,0,0,0,1,1
SCISKILLS07_TFS,Science Skill: Ask relevant questions,1,0,0,0,0,0,0,0,0,0,0,0,0,0,0,0,0,0,0,0,0,0,0,0,0,0,0,0,0,0
SCISKILLS08_TFS,Science Skill: Identify what is known and not known about a problem,1,0,0,0,0,0,0,0,0,0,0,0,0,0,0,0,0,0,0,0,0,0,0,0,0,0,0,0,0,0
SCISKILLS09_TFS,Science Skill: Understand scientific concepts,1,0,0,0,0,0,0,0,0,0,0,0,0,0,0,0,0,0,0,0,0,0,0,0,0,0,0,0,0,0
SCISKILLS10_TFS,Science Skill: See connections between different areas of science and mathematics,1,1,1,0,0,0,0,0,0,0,0,0,0,0,0,0,0,0,0,0,0,0,0,0,0,0,0,0,0,0
SEXIMP_TFS,Sex imputed,0,0,1,0,0,0,0,0,0,0,0,0,0,0,0,0,0,0,0,0,0,0,0,0,0,0,0,1,1,1
SIBLIVE1_T2_TFS,Number of older brothers,0,0,0,0,0,0,0,0,0,0,0,0,0,0,0,0,0,0,0,0,0,0,0,0,0,1,1,0,0,0
SIBLIVE2_T2_TFS,Number of older sisters,0,0,0,0,0,0,0,0,0,0,0,0,0,0,0,0,0,0,0,0,0,0,0,0,0,1,1,0,0,0
SIBLIVE3_T2_TFS,Number of younger brothers,0,0,0,0,0,0,0,0,0,0,0,0,0,0,0,0,0,0,0,0,0,0,0,0,0,1,1,0,0,0
SIBLIVE4_T2_TFS,Number of younger sisters,1,1,1,1,1,1,1,1,1,1,0,0,0,0,0,0,0,0,0,0,0,0,0,0,0,0,0,0,0,0
SLFABL01_TFS,General knowledge,0,0,1,0,0,0,0,0,0,0,0,0,0,0,0,0,0,0,0,0,0,0,0,0,0,0,0,1,1,1
SLFABL02_TFS,Knowledge of a particular field or discipline,0,0,1,0,0,0,0,0,0,0,0,0,0,0,0,0,0,0,0,0,0,0,0,0,0,0,0,0,0,0
SLFABL03_TFS,Knowledge of people from different races/cultures,0,0,1,0,0,0,0,0,0,0,0,0,0,0,0,0,0,0,0,0,0,0,0,0,0,0,0,0,0,0
SLFABL04_TFS,Understanding of the problems facing your community,0,0,1,0,0,0,0,0,0,0,0,0,0,0,0,0,0,0,0,0,0,0,0,0,0,0,0,0,0,0
SLFABL05_TFS,Understanding of national issues,0,0,1,0,0,0,0,0,0,0,0,0,0,0,0,0,0,0,0,0,0,0,0,0,0,0,0,1,0,0
SLFABL06_TFS,Understanding of global issues,0,0,1,0,0,0,0,0,0,0,0,0,0,0,0,0,0,0,0,0,0,0,0,0,0,0,0,1,1,1
SLFABL07_TFS,Critical thinking skills,0,0,1,0,0,0,0,0,0,0,0,0,0,0,0,0,0,0,0,0,0,0,0,0,0,0,0,0,0,0
SLFABL08_TFS,Problem-solving skills,0,0,1,0,0,0,0,0,0,0,0,0,0,0,0,0,0,0,0,0,0,0,0,0,0,0,0,1,0,0
SLFABL09_TFS,Ability to manage your time effectively,0,0,1,0,0,0,0,0,0,0,0,0,0,0,0,0,0,0,0,0,0,0,0,0,0,0,0,1,1,1
SLFABL10_TFS,Foreign language ability,0,0,1,0,0,0,0,0,0,0,0,0,0,0,0,0,0,0,0,0,0,0,0,0,0,0,0,0,0,0
SLFABL11_TFS,Interpersonal skills,1,1,0,0,0,0,0,0,0,0,0,0,0,0,0,0,0,0,0,0,0,0,0,0,0,0,0,1,1,1
SRELIGION_TFS,Student's religion,1,1,1,1,1,1,1,1,1,1,1,1,1,1,1,1,1,1,1,1,1,1,1,1,1,1,1,0,0,0
SRELIGIONA_TFS,Your religious preference,0,0,0,0,1,0,1,1,1,1,1,1,1,1,1,1,1,0,1,1,1,1,1,1,1,1,1,0,0,0
