name,description,2016,2015,2014,2013,2012,2011,2010,2009,2008,2007,2006,2005,2004,2003,2002,2001,2000,1999,1998,1997,1996,1995,1994,1993,1992,1991,1990,1989,1988,1987
ACE_TFS,College I.D.,1,0,0,0,0,0,1,1,1,1,1,1,1,1,1,1,1,1,1,1,1,1,1,1,1,1,1,1,1,1
SUBJID_TFS,Subject I.D.,1,1,1,1,1,1,1,1,1,1,1,1,1,1,1,1,1,1,1,1,1,1,1,1,1,1,1,1,1,1
MATCHLEVEL_TFS,Type of Match,1,1,1,1,1,1,1,1,1,1,1,1,0,0,0,0,0,0,0,0,0,0,0,0,0,0,0,0,0,0
STUDSTAT_TFS,Student status,0,0,0,0,1,1,1,1,1,1,1,1,1,1,1,1,1,1,1,1,1,1,1,1,1,1,1,1,1,1
PERMIT_TFS,Do you give HERI permission to include your id number should your college request the data for additional research analyses?,1,1,1,1,1,1,1,1,1,1,1,1,1,1,1,1,1,1,1,1,1,1,1,1,1,1,1,1,1,1
SEX_TFS,Your sex:,1,1,1,1,1,1,1,1,1,1,1,1,1,1,1,1,1,1,1,1,1,1,1,1,1,1,1,1,1,1
ACCPT1ST_TFS,Were you accepted by your first choice college?,1,1,1,1,1,1,1,1,1,1,1,1,1,1,1,1,1,1,1,1,1,1,1,1,1,1,1,1,1,1
ACT01_TFS,Act in Past Year: Asked a teacher for advice after class,0,0,0,0,0,0,0,0,0,0,0,0,1,1,1,1,1,1,1,1,0,0,1,1,1,1,1,0,1,1
ACT02_TFS,Act in Past Year: Attended a public recital or concert,1,1,1,1,1,1,1,1,1,1,1,1,1,1,1,1,1,1,1,1,1,1,1,1,1,1,1,0,1,1
ACT03_TFS,Act in Past Year: Attended a religious service,1,1,1,1,1,1,1,1,1,1,1,1,1,1,1,1,1,1,1,1,0,0,1,1,1,1,1,0,1,1
ACT04_TFS,Act in Past Year: Came late to class,0,0,0,0,0,0,0,0,0,0,0,0,0,0,1,1,1,1,1,1,0,0,0,1,0,1,1,0,1,1
ACT05_TFS,Act in Past Year: Checked out a book or journal from the school library,0,0,0,0,0,0,0,0,0,0,0,1,1,1,1,1,1,0,1,1,0,0,0,0,0,0,0,0,1,1
ACT06_TFS,Act in Past Year: Communicated via e-mail,1,1,1,0,1,0,0,0,1,1,1,1,1,1,1,1,1,1,1,1,1,1,1,1,1,1,1,0,1,1
ACT07_TFS,Act in Past Year: Demonstrated for/against a cause,1,1,1,1,1,1,1,1,1,1,1,1,1,1,1,1,1,1,1,1,1,1,1,1,1,1,1,0,1,1
ACT08_TFS,Act in Past Year: Discussed politics,1,1,1,1,1,1,1,1,1,1,1,1,1,1,1,1,1,1,1,1,0,0,1,1,0,1,1,1,0,0
ACT09_TFS,Act in Past Year: Discussed religion,1,1,1,1,1,1,1,1,1,1,1,1,1,1,1,1,1,1,1,1,1,1,1,1,1,1,1,1,0,0
ACT10_TFS,Act in Past Year: Drank beer,1,1,1,1,1,1,1,1,1,1,1,1,1,1,1,1,1,1,1,1,1,1,1,1,1,1,1,1,0,0
ACT11_TFS,Act in Past Year: Drank wine or liquor,1,1,1,1,1,1,1,0,0,0,0,0,0,0,0,0,0,0,1,1,0,1,1,1,1,1,1,1,0,0
ACT12_TFS,Act in Past Year: Failed to complete a homework assignment on time,1,1,1,0,1,1,1,0,0,0,0,0,0,0,0,0,0,0,0,0,0,0,0,0,0,0,0,1,0,0
ACT13_TFS,Act in Past Year: Fell asleep in class,1,1,1,1,1,1,1,1,1,1,1,1,1,1,1,1,1,1,1,1,1,1,1,1,1,1,1,1,0,0
ACT14_TFS,Act in Past Year: Felt depressed,1,1,1,1,1,1,1,1,1,1,1,1,1,1,1,1,1,1,1,1,1,1,1,1,1,1,1,0,0,0
ACT15_TFS,Act in Past Year: Felt overwhelmed by all I had to do,1,1,1,0,1,1,1,0,0,0,0,0,0,0,0,0,0,0,0,0,0,0,0,0,0,0,0,1,0,0
ACT16_TFS,Act in Past Year: Helped raise money for a cause,0,0,0,0,0,0,0,0,0,0,0,1,1,1,1,1,1,1,1,1,1,1,1,1,0,1,1,1,0,0
ACT17_TFS,Act in Past Year: Overslept and missed a class or appointment,0,1,1,1,1,1,1,1,1,1,1,1,1,1,1,1,1,0,1,1,0,0,0,0,0,0,0,1,0,0
ACT19_TFS,Act in Past Year: Performed community service as part of a class,1,1,1,1,1,1,1,1,1,1,1,1,1,1,1,1,1,1,1,1,1,1,1,1,1,1,1,1,0,0
ACT20_TFS,Act in Past Year: Performed volunteer work,0,0,0,0,0,0,1,1,1,1,1,1,1,1,1,1,1,1,1,1,1,1,1,1,1,1,1,1,0,0
ACT21_TFS,Act in Past Year: Played a musical instrument,1,1,1,0,1,1,1,0,0,0,0,0,0,0,0,0,0,0,0,0,0,0,0,0,0,0,0,1,0,0
ACT22_TFS,Act in Past Year: Publicly communicated my opinion about a cause,1,1,1,1,1,1,1,1,0,0,0,0,0,0,0,0,0,0,0,0,0,0,0,0,0,0,0,0,0,0
ACT23_TFS,Act in Past Year: Skipped school/class,0,1,1,1,1,1,1,1,1,1,1,1,1,1,1,1,1,1,1,1,1,1,1,1,1,1,1,1,1,1
ACT24_TFS,Act in Past Year: Smoked cigarettes,1,1,1,1,1,1,1,1,1,1,1,1,1,1,1,1,1,1,1,1,1,0,1,1,0,1,1,1,1,1
ACT25_TFS,Act in Past Year: Socialized with someone of another racial/ethnic group,1,1,1,1,1,1,1,1,1,1,1,1,1,1,1,1,1,1,1,1,1,1,1,1,1,1,1,1,1,1
ACT26_TFS,Act in Past Year: Studied with other students,1,1,1,1,1,1,1,1,1,1,1,1,1,1,1,1,1,1,1,1,1,1,1,1,1,1,1,0,0,0
ACT27_TFS,Act in Past Year: Tutored another student,0,0,0,0,0,0,1,1,1,1,1,1,1,1,1,1,1,1,1,1,0,1,1,1,0,1,1,1,1,1
ACT28_TFS,Act in Past Year: Used a personal computer,0,0,1,1,1,0,1,0,0,1,1,1,1,1,1,1,1,0,1,1,0,0,0,0,0,0,0,0,0,0
ACT29_TFS,Act in Past Year: Used the Internet for research or homework,0,0,0,0,0,0,0,0,0,0,0,1,1,1,1,1,1,1,1,1,0,0,1,1,0,1,1,0,0,0
ACT30_TFS,Act in Past Year: Visited an art gallery or museum,1,1,1,1,1,1,1,1,1,1,1,1,1,1,1,1,1,1,1,1,1,1,1,1,1,1,1,0,1,0
ACT31_TFS,Act in Past year: Voted in a student election,0,0,1,1,1,1,1,1,1,1,1,1,1,1,1,1,1,1,1,1,1,1,1,1,1,1,1,0,1,0
ACT32_TFS,Act in Past Year: Was a guest in a teacher's home,1,1,1,1,1,1,1,1,1,1,1,1,1,1,1,1,1,1,1,1,1,1,1,1,1,1,1,0,0,0
ACT33_TFS,Act in Past Year: Was bored in class,0,1,1,1,1,1,1,1,1,1,1,1,1,0,1,1,1,0,1,1,1,1,1,1,1,1,1,0,0,0
ACT34_TFS,"Act in Past Year: Worked in a local, state, or national political campaign",0,1,1,0,0,0,0,0,0,0,0,0,0,0,0,0,0,0,0,0,0,0,0,0,0,0,0,0,0,0
ACT35_TFS,"Act in Past Year: Used an online instructional website (e.g. Khan Academy, Coursera) as assigned for a class",0,1,1,0,0,0,0,0,0,0,0,0,0,0,0,0,0,0,0,0,0,0,0,0,0,0,0,0,0,0
ACT36_TFS,"Act in Past Year: Used an online instructional website (e.g. Khan Academy, Coursera) to learn something on your own",1,0,0,0,0,0,0,0,0,0,0,0,0,0,0,0,0,0,0,0,0,0,0,0,0,0,0,0,0,0
ACT37_TFS,Act in Past Year: Felt Anxious,0,0,0,0,0,0,0,0,0,0,0,0,0,0,1,1,1,1,1,1,1,1,1,1,1,1,1,0,0,0
AGE_TFS,How old will you be on December 31 of this year?,0,0,0,0,0,1,0,0,0,0,0,0,0,0,0,0,0,0,0,0,0,0,0,0,0,0,0,0,0,0
AGE1_TFS,How old will you be on December 31 of this year?,0,0,0,0,1,0,1,1,1,1,1,1,1,1,1,1,1,1,1,1,1,1,1,1,1,1,1,0,0,0
AGE2_TFS,How old will you be on December 31 of this year?,1,1,1,1,0,0,1,1,1,1,1,1,1,1,1,1,1,1,1,1,1,1,1,1,1,1,1,0,0,0
AID01_TFS,"Aid: Parents, other relatives or friends",0,0,0,0,0,0,0,0,0,0,0,0,0,0,1,1,1,1,1,1,1,1,1,1,1,1,1,0,0,0
AID02_TFS,Aid: Spouse,0,0,0,0,0,0,0,0,0,0,0,0,0,0,1,1,1,1,1,1,1,1,1,1,1,1,1,0,0,0
AID03_TFS,Aid: Savings from summer work,0,0,0,0,0,0,0,0,0,0,0,0,0,0,1,1,1,1,1,1,1,1,1,1,1,1,1,0,0,0
AID04_TFS,Aid: Other savings,0,0,0,0,0,0,0,0,0,0,0,0,0,0,1,1,1,1,1,1,1,1,1,1,1,1,1,0,0,0
AID05_TFS,Aid: Part-time job on campus,0,0,0,0,0,0,0,0,0,0,0,0,0,0,1,1,1,1,1,1,1,1,1,1,1,1,1,0,0,0
AID06_TFS,Aid: Part-time job off campus,0,0,0,0,0,0,0,0,0,0,0,0,0,0,1,1,1,1,1,1,1,1,1,1,1,1,1,0,0,0
AID07_TFS,Aid: Full-time job while in college,0,0,0,0,0,0,0,0,0,0,0,0,0,0,1,1,1,1,1,1,1,1,1,1,1,1,1,0,0,0
AID08_TFS,Aid: Pell Grant,0,0,0,0,0,0,0,0,0,0,0,0,0,0,1,1,1,1,1,1,1,1,1,1,1,1,1,0,0,0
AID09_TFS,Aid: Supplemental Educational Opportunity Grant,0,0,0,0,0,0,0,0,0,0,0,0,0,0,1,1,1,1,1,1,1,1,1,1,1,1,1,0,0,0
AID1_TFS,"Aid: Family resources (parents, relatives, spouse, etc.)",1,1,1,1,1,1,1,1,1,1,1,1,1,1,1,1,1,0,1,0,0,0,0,0,0,0,0,0,0,0
AID2_TFS,"Aid: My own resources (savings from work, work-study, other income)",1,1,1,1,1,1,1,1,1,1,1,1,1,1,1,1,1,0,1,0,0,0,0,0,0,0,0,0,0,0
AID3_TFS,"Aid: Aid which need not be repaid (grants, scholarships, military funding, etc.)",1,1,1,1,1,1,1,1,1,1,1,1,1,1,1,1,1,0,1,0,0,0,0,0,0,0,0,0,0,0
AID4_TFS,"Aid: Aid which must be repaid (loans, etc.)",1,1,1,1,1,1,1,1,1,1,1,1,1,1,1,1,1,0,1,0,0,0,0,0,0,0,0,0,0,0
AID5_TFS,Aid: Other than above,1,1,0,0,0,0,0,0,0,0,0,0,0,0,0,0,0,0,0,0,0,0,0,0,0,0,0,0,0,0
AID10_TFS,Aid: State scholarship or grant,0,0,0,0,0,0,0,0,0,0,0,0,0,0,1,1,1,1,1,1,1,1,1,1,1,1,1,0,0,0
AID11_TFS,Aid: College work-study grant,0,0,0,0,0,0,0,0,0,0,0,0,0,0,1,1,1,1,1,1,1,1,1,1,1,1,1,0,0,0
AID12_TFS,Aid: College grants/scholarship (other than above),0,0,0,0,0,0,0,0,0,0,0,0,0,0,1,1,1,1,1,1,1,0,1,1,0,1,1,0,0,0
AID13_TFS,Aid: Vocational Rehabilitation funds,0,0,0,0,0,0,0,0,0,0,0,0,0,0,1,1,1,1,1,1,1,1,1,1,1,1,1,0,0,0
AID14_TFS,Aid: Other private grant,0,0,0,0,0,0,0,0,0,0,0,0,0,0,1,1,1,1,1,1,1,1,1,1,1,1,1,0,0,0
AID15_TFS,"Aid: Other government aid (ROTC, BIA, GI/military benefits, etc.)",0,0,0,0,0,0,0,0,0,0,0,0,0,0,1,1,1,1,1,1,1,1,1,1,1,1,1,0,0,0
AID16_TFS,Aid: Stafford loan (GSL),0,0,0,0,0,0,0,0,0,0,0,0,0,0,1,1,1,1,1,1,1,1,1,1,1,1,1,0,0,0
AID17_TFS,Aid: Perkins loan,0,0,0,0,0,0,0,0,0,0,0,0,0,0,1,1,1,1,1,1,1,1,1,1,1,1,1,0,0,0
AID18_TFS,Aid: Other college loan,0,0,0,0,0,0,0,0,0,0,0,0,0,0,1,1,1,1,1,1,1,1,1,1,1,1,1,0,0,0
AID19_TFS,Aid: Other loan,0,0,0,0,0,0,0,0,0,0,0,0,0,0,1,1,1,1,1,1,1,1,1,1,1,1,1,0,0,0
AID20_TFS,Aid: Other than above,1,1,1,1,1,1,1,1,1,1,1,1,1,1,1,1,1,0,1,0,0,0,0,0,0,0,0,0,0,0
AIDTYPE1_TFS,Military grants,1,1,0,0,0,0,0,0,0,0,0,0,0,0,0,0,0,0,0,0,0,0,0,0,0,0,0,0,0,0
AIDTYPE2_TFS,Work-study,1,1,0,0,0,0,0,0,0,0,0,0,0,0,0,0,0,0,0,0,0,0,0,0,0,0,0,0,0,0
AIDTYPE3_TFS,Pell Grant,1,1,0,0,0,0,0,0,0,0,0,0,0,0,0,0,0,0,0,0,0,0,0,0,0,0,0,0,0,1
AIDTYPE4_TFS,Need-based grants or scholarships,1,1,0,0,0,0,0,0,0,0,0,0,0,0,0,0,0,0,0,0,0,0,0,0,0,0,0,1,1,1
AIDTYPE5_TFS,Merit-based grants or scholarships,1,1,1,1,1,1,1,1,1,1,1,1,1,1,1,1,1,1,1,1,1,1,1,1,1,1,1,0,0,0
APCOURSE_T2_TFS,AP Courses,0,0,0,0,0,0,0,0,0,0,0,0,1,1,1,1,1,0,1,1,0,0,0,0,0,0,0,0,0,0
APCOURSE_TFS,How many Advanced Placement courses did you take in high school?,0,0,0,0,0,0,1,1,1,1,1,0,0,0,0,0,0,0,0,0,0,0,0,0,0,0,0,0,0,0
APEXAM_T2_TFS,AP Exams,0,0,0,0,0,0,0,0,0,0,0,1,1,1,1,1,1,0,0,0,0,0,0,0,0,0,0,0,0,0
APEXAM_TFS,How many Advanced Placement exams did you take in high school?,0,0,0,0,0,0,0,0,0,1,1,1,1,1,1,1,1,0,1,1,0,0,0,0,0,0,0,0,0,0
BORNAGAIN_TFS,Do you consider yourself a born-again Christian?,0,0,0,0,1,0,1,1,1,1,0,0,0,0,0,0,0,0,0,0,0,0,0,0,0,0,0,0,0,0
CHOICE_TFS,Choice: Is this college your:,0,0,0,0,0,0,1,1,1,0,0,0,0,0,0,0,1,0,1,1,1,1,1,1,1,1,1,0,0,0
CHOOSE01_TFS,Choose to Attend: A college rep. recruited me,0,0,0,0,0,0,0,0,0,0,0,0,0,0,0,0,1,0,1,1,1,1,1,1,1,1,1,0,0,0
CHOOSE02_TFS,Choose to Attend: A friend suggested attending,1,1,1,1,1,1,1,1,1,1,1,1,1,1,1,1,1,0,0,0,0,0,0,0,0,0,0,,,
CHOOSE03_TFS,Choose to Attend: A visit to campus,0,0,1,1,1,1,1,1,0,0,0,0,0,0,0,0,0,0,0,0,0,0,0,0,0,0,0,0,1,0
CHOOSE04_TFS,Choose to Attend: Ability to take online courses,1,1,1,1,1,1,1,1,1,1,1,0,0,0,0,0,0,0,0,0,0,0,0,0,0,0,0,0,1,0
CHOOSE05_TFS,Choose to Attend: Could not afford first choice,1,1,1,1,1,1,1,1,1,1,1,1,1,1,1,1,1,1,1,1,1,0,1,1,0,1,1,1,1,1
CHOOSE06_TFS,Choose to Attend: High school counselor advised me,1,1,1,1,1,1,1,1,1,1,1,1,1,1,1,1,1,1,1,1,1,1,1,1,1,1,1,1,1,1
CHOOSE07_TFS,Choose to Attend: I wanted to go to a school about the size of this college,1,1,1,1,1,1,1,1,1,1,1,1,1,1,1,1,1,1,1,1,1,1,1,1,1,1,1,1,1,1
CHOOSE09_TFS,Choose to Attend: I wanted to live near home,1,1,1,1,1,1,1,1,1,1,1,1,1,1,1,1,1,0,1,1,0,0,0,0,0,0,0,,,
CHOOSE10_TFS,Choose to Attend: I was admitted through an Early Action or Early Decision program,1,1,1,1,1,1,1,1,1,1,1,1,1,1,1,1,1,1,1,1,1,1,1,1,1,1,1,1,1,1
CHOOSE11_TFS,Choose to Attend: I was attracted by the religious affiliation/orientation of the college,1,1,1,1,1,1,1,1,1,1,1,1,1,1,1,1,1,1,1,1,1,1,1,1,1,1,1,1,1,1
CHOOSE12_TFS,Choose to Attend: I was offered financial assistance,0,0,1,1,1,1,1,1,1,1,1,1,1,1,1,1,1,0,1,1,0,0,0,0,0,0,0,,,
CHOOSE13_TFS,Choose to Attend: Information from a website,0,0,0,0,0,0,0,0,0,0,0,0,0,0,0,0,0,0,0,0,0,0,1,1,1,1,1,0,0,1
CHOOSE14_TFS,Choose to Attend: My guidance counselor advised me,0,1,1,1,1,1,1,1,1,1,0,0,0,0,0,0,0,0,0,0,0,0,0,0,0,0,0,1,1,0
CHOOSE15_TFS,Choose to Attend: My parents/relatives wanted me to come here,0,0,1,1,1,1,1,1,1,1,1,1,1,1,1,1,1,1,1,1,1,1,1,1,1,1,1,0,0,0
CHOOSE16_TFS,Choose to Attend: My relatives wanted me to come here,1,1,1,1,1,1,1,1,1,1,1,1,1,1,1,1,1,1,1,1,1,1,1,1,1,1,1,1,0,0
CHOOSE17_TFS,Choose to Attend: My teacher advised me,0,0,0,0,0,0,0,0,0,0,0,0,0,1,1,1,1,1,1,1,1,1,1,1,1,1,1,0,0,1
CHOOSE18_TFS,Choose to Attend: Not accepted anywhere else,1,1,1,1,1,1,1,1,1,1,1,1,1,1,1,1,1,1,1,1,1,0,1,1,0,1,1,,,
CHOOSE19_TFS,Choose to Attend: Not offered aid by first choice,1,1,1,1,1,1,1,1,1,1,1,1,1,1,1,1,1,1,1,1,1,0,1,1,0,1,1,1,1,1
CHOOSE20_TFS,Choose to Attend: Private college counselor advised me,1,1,1,1,1,1,1,1,1,1,1,1,1,1,1,1,1,1,1,1,1,0,1,1,0,0,0,0,0,0
CHOOSE21_TFS,Choose to Attend: Rankings in national magazines,0,1,1,1,1,1,1,1,1,1,1,0,1,1,1,1,1,0,1,1,1,1,1,1,1,1,1,1,1,1
CHOOSE22_TFS,Choose to Attend: The athletic department recruited me,1,1,1,1,1,1,1,1,1,1,1,1,1,0,1,1,0,0,0,0,0,0,0,0,0,0,0,1,1,1
CHOOSE23_TFS,Choose to Attend: The cost of attending this college,0,1,1,1,1,1,1,1,1,1,1,1,1,1,1,1,1,1,1,1,1,1,1,1,1,1,1,1,1,1
CHOOSE24_TFS,Choose to Attend: This college has a good reputation for its social activities,1,1,1,1,1,1,1,1,1,1,1,1,1,1,1,1,1,1,1,1,1,1,1,1,1,1,1,0,0,0
CHOOSE25_TFS,Choose to Attend: This college has a very good academic reputation,0,0,0,0,0,0,0,0,0,0,0,1,1,1,1,1,1,1,1,1,1,1,1,1,1,1,1,1,0,0
CHOOSE26_TFS,Choose to Attend: This college has low tuition,0,0,0,0,0,0,0,0,0,0,0,1,1,1,1,1,1,1,1,1,1,1,1,1,1,1,1,0,0,0
CHOOSE27_TFS,Choose to Attend: This college offers special educational programs,1,1,1,1,1,1,1,1,1,1,1,1,1,1,1,1,1,1,1,1,1,1,1,1,1,1,1,1,1,0
CHOOSE28_TFS,Choose to Attend: This college's graduates gain admission to top graduate/professional schools,1,1,1,1,1,1,1,1,1,1,1,1,1,1,1,1,1,1,1,1,1,1,1,1,1,1,1,1,1,1
CHOOSE29_TFS,Choose to Attend: This college's graduates get good jobs,0,1,1,0,1,0,0,0,0,0,0,0,0,0,0,0,0,0,0,0,0,0,0,0,0,0,0,0,1,0
CHOOSE30_TFS,Choose to Attend: The percentage of students that graduate from this college,1,0,0,0,0,0,0,0,0,0,0,0,0,0,0,0,0,0,0,0,0,0,0,0,0,0,0,1,0,0
CHOOSE31_TFS,Choose to Attend: My parents/relatives wanted me to come here,1,0,0,0,0,0,0,0,0,0,0,0,0,0,0,0,0,0,0,0,0,0,0,0,0,0,0,0,1,1
CHOOSE32_TFS,Choose to Attend: This college has a good reputation for its social and extracurricular activities,1,0,0,0,0,0,0,0,0,0,0,0,0,0,0,0,0,0,0,0,0,0,0,0,0,0,0,0,1,1
CHOOSE33_TFS,Choose to Attend: This college's graduates make a difference in the world,0,0,0,0,0,0,0,0,0,0,0,0,0,0,0,0,0,0,0,0,0,0,1,1,0,1,1,0,0,0
CITIZEN_TFS,Citizenship status:,0,0,0,0,0,0,0,0,0,0,0,0,0,0,0,0,0,1,0,0,1,1,0,0,1,0,0,1,1,1
CITIZEN2_TFS,Citizenship status,0,0,0,0,0,0,1,1,1,0,1,1,1,1,1,1,1,0,1,1,0,0,1,1,1,1,1,0,0,0
CRED1_TFS,For credit at any other institution,0,0,0,0,0,0,0,0,0,0,0,1,1,1,1,1,1,1,1,1,0,1,1,1,1,1,1,1,1,1
CRED2_TFS,For credit at junior college or community college,0,0,0,0,0,0,0,0,0,0,0,1,1,1,1,1,1,1,1,1,0,1,1,1,1,1,1,0,0,0
CRED3_TFS,For credit at a four-year college or university,0,0,0,0,0,0,0,0,0,0,0,1,1,1,1,1,1,1,1,1,0,1,1,1,1,1,1,0,1,0
CRED4_TFS,For credit at some other postsecondary,1,1,0,0,0,0,0,0,0,0,0,0,0,0,0,0,0,0,0,0,0,0,0,0,0,0,0,0,1,0
CSVREQ_TFS,Did your high school require community service for graduation?,1,1,1,1,1,1,1,1,1,1,0,0,0,0,0,0,0,0,0,0,0,0,0,0,0,0,0,0,0,0
DEGASP_TFS,Highest academic degree planned,1,1,1,1,1,1,1,1,1,1,1,1,1,1,1,1,1,1,1,1,1,1,1,1,1,1,1,0,0,0
DESCRIBE1_T2_TFS,Describe: Searching for mission/purpose in life,0,0,0,0,0,0,0,0,0,0,0,1,1,1,1,1,1,0,0,0,0,0,0,0,0,0,0,0,0,0
DESCRIBE2_T2_TFS,Describe: Engaging in self-reflection,0,0,0,0,0,0,0,0,0,0,0,1,1,1,1,1,1,0,0,0,0,0,0,0,0,0,0,0,0,0
DESCRIBE3_T2_TFS,Describe: Appreciating interconnectedness of everything,0,0,0,0,0,0,0,0,0,0,0,1,1,1,1,1,1,0,0,0,0,0,0,0,0,0,0,0,0,0
DESCRIBE4_T2_TFS,Describe: Believing in sacredness of life,0,0,0,0,0,0,0,0,0,0,0,1,1,1,1,1,1,0,0,0,0,0,0,0,0,0,0,0,0,0
DESCRIBE5_T2_TFS,Describe: Being honest in my relationships with others,0,0,0,0,0,0,0,0,0,0,0,0,0,0,0,0,0,0,0,0,0,0,1,1,0,1,1,0,0,0
DISAB01_TFS,Disability: Learning disability,1,1,1,0,0,0,1,0,0,0,0,0,0,0,0,0,0,0,0,0,0,0,0,0,0,0,0,0,1,1
DISAB02_TFS,Disability: ADHD,1,1,1,0,0,0,1,0,0,0,0,0,0,0,0,0,0,0,0,0,0,0,0,0,0,0,0,0,1,1
DISAB03_TFS,Disability: Autism spectrum/Asperger's syndrome,0,0,1,0,0,0,0,0,0,0,0,0,0,0,0,0,0,0,0,0,0,0,0,0,0,0,0,0,0,1
DISAB04_TFS,Disability: Physical disability,1,1,1,0,0,0,1,0,0,0,0,0,0,0,0,0,0,0,0,0,0,0,0,0,0,0,0,0,0,0
DISAB05_TFS,Disability: Chronic illness,1,1,1,0,0,0,1,0,0,0,0,0,0,0,0,0,0,0,0,0,0,0,0,0,0,0,0,0,0,0
DISAB06_TFS,Disability: Psychological disorder,1,1,1,0,0,0,1,0,0,0,0,0,0,0,0,0,0,0,0,0,0,0,0,0,0,0,0,0,0,0
DISAB07_TFS,Disability: Other disability,0,0,0,0,0,0,0,0,0,1,1,1,1,1,1,1,1,0,0,1,0,0,1,1,0,1,0,0,0,0
DISAB08_TFS,Autism spectrum/Asperger's syndrome,1,1,1,1,1,1,1,1,1,1,1,1,1,1,1,1,1,1,1,1,1,1,1,1,1,1,1,0,0,0
DISAB1_TFS,Disability: None,0,0,0,0,0,0,1,1,1,0,1,1,1,1,1,1,1,0,1,1,1,0,1,1,1,1,1,1,1,1
DISAB2_TFS,Disability: Hearing,0,0,0,0,0,0,1,1,1,0,1,1,1,1,1,1,1,0,1,1,1,0,1,1,1,1,1,1,0,0
DISAB3_TFS,Disability: Speech,0,0,0,0,0,0,1,1,1,0,1,1,1,1,1,1,1,0,1,1,1,0,1,1,1,1,1,0,1,1
DISAB4_TFS,Disability: Orthopedic,0,0,1,0,0,0,1,1,1,0,1,1,1,1,1,1,1,0,1,1,1,0,1,1,1,1,1,0,1,1
DISAB5_TFS,Disability: Learning disability,0,0,0,0,0,0,1,1,1,0,1,1,1,1,1,1,1,0,1,1,1,0,1,1,1,1,1,0,1,1
DISAB6_TFS,Disability: Health-related,0,0,0,0,0,0,1,1,1,0,1,1,1,1,1,1,1,0,1,1,1,0,1,1,1,1,1,0,1,1
DISAB7_TFS,Disability: Partially sighted or blind,0,0,0,0,0,0,1,1,1,0,1,1,1,1,1,1,1,0,1,1,1,0,1,1,1,1,1,0,1,1
DISAB8_TFS,Disability: Other,1,1,1,0,0,0,1,0,0,0,0,0,0,0,0,0,0,0,0,0,0,0,0,0,0,0,0,0,1,1
DISTHOME_TFS,How many miles is this college from your permanent home?,1,1,1,1,1,1,1,1,1,0,0,0,0,0,0,0,0,0,0,0,0,0,0,0,0,0,0,0,0,0
DIVRATE1_TFS,Diversity Rating: Ability to see the world from someone else's perspective,1,1,1,1,1,1,1,1,1,0,0,0,0,0,0,0,0,0,0,0,0,0,0,0,0,0,0,0,0,1
DIVRATE2_TFS,Diversity Rating: Tolerance of others with different beliefs,1,1,1,1,1,1,1,1,1,0,0,0,0,0,0,0,0,0,0,0,0,0,0,0,0,0,0,0,0,0
DIVRATE3_TFS,Diversity Rating: Openness to having my own views challenged,1,1,1,1,1,1,1,1,1,0,0,0,0,0,0,0,0,0,0,0,0,0,0,0,0,0,0,0,0,0
DIVRATE4_TFS,Diversity Rating: Ability to discuss and negotiate controversial issues,1,1,1,1,1,1,1,1,1,0,0,0,0,0,0,0,0,0,0,0,0,0,0,0,0,0,0,0,0,1
DIVRATE5_TFS,Diversity Rating: Ability to work cooperatively with diverse people,1,1,0,0,0,0,0,0,0,0,0,0,0,0,0,0,0,0,0,0,0,0,0,0,0,0,0,0,0,0
DIVRATE6_TFS,Critical thinking skills,1,1,0,0,0,0,0,0,0,0,0,0,0,0,0,0,0,0,0,0,0,0,0,0,0,0,0,0,0,0
DIVRATE7_TFS,Ability to manage your time effectively,0,1,1,1,1,1,1,0,0,0,0,0,0,0,0,0,0,0,0,0,0,0,0,0,0,0,0,0,0,0
ECONOMIC_TFS,The current economic situation significantly affected my college choice:,1,1,1,0,1,0,0,0,0,0,0,0,0,0,0,0,0,0,0,0,0,0,0,0,0,0,0,0,0,0
EVANGEL_TFS,Do you consider yourself Evangelical?,0,0,0,0,0,0,0,0,0,0,0,1,1,1,1,1,1,0,0,1,0,0,1,1,0,1,0,0,0,0
EXPGRAD_TFS,How many years do you expect it will take you to graduate from this college?,1,1,1,1,1,1,1,1,1,1,1,1,1,1,1,1,1,1,1,1,1,1,1,1,1,1,1,0,0,0
FATHEDUC_TFS,Father's education,1,1,1,1,1,1,1,1,1,1,1,1,1,1,1,1,1,1,1,1,1,1,1,1,1,1,1,0,0,0
FCAREER_TFS,Father's career,1,1,1,1,1,1,1,1,1,1,1,1,1,1,1,1,1,0,1,1,1,1,1,1,1,1,1,0,0,0
FCAREERA_TFS,Mother's aggregated career,1,1,1,1,1,1,1,1,1,1,1,1,1,1,1,1,1,0,1,1,1,1,1,1,1,1,1,0,0,0
FEMPLOY_TFS,Father's Employment Status,1,1,1,0,0,0,0,0,0,0,0,0,0,0,0,0,0,0,0,0,0,0,0,0,0,0,0,0,0,0
FINCON_TFS,Do you have any concern about your ability to finance your college education?,1,0,0,0,0,0,0,0,0,0,0,0,0,0,0,0,0,0,0,0,0,0,0,0,0,0,0,1,1,1
FIRSTGEN_TFS,First generation status based on parent(s) with less than 'some college',1,1,1,1,0,0,1,1,1,1,1,1,1,1,1,1,1,1,1,1,1,1,1,1,1,1,1,0,0,0
FOSTERCARE_TFS,"At any time since you turned 13, were you in foster care or were you a dependent of the court?",0,0,0,0,0,0,0,0,0,0,0,0,0,0,1,1,1,1,1,1,0,1,1,1,1,1,1,1,1,1
FRELIGION_TFS,Father's religion,1,1,1,1,1,1,1,1,1,1,1,1,1,1,1,1,1,1,1,1,1,1,1,1,1,1,1,0,0,0
FRELIGIONA_TFS,Your father's religious preference,1,1,1,1,0,0,1,1,1,1,1,1,1,1,1,1,1,1,1,1,1,1,1,1,1,1,1,1,1,1
FULLSTAT_TFS,Are you enrolled (or enrolling) as a:,0,0,0,0,0,0,0,0,0,0,0,0,0,0,0,0,0,0,0,0,0,0,1,1,0,1,1,1,1,1
FUTACT01_TFS,Future Act: Be elected to an academic honor society,0,0,0,0,0,0,0,0,0,0,0,0,0,0,1,1,1,1,1,1,1,1,1,1,1,1,1,1,0,0
FUTACT02_TFS,Future Act: Be elected to student office,0,1,1,1,1,1,1,1,1,1,1,1,1,1,1,1,1,1,1,1,1,1,1,1,1,1,1,0,0,0
FUTACT03_TFS,Future Act: Be satisfied with your college,1,1,1,1,1,1,1,1,1,1,1,1,1,1,1,1,1,1,1,1,1,1,1,1,1,1,1,1,0,0
FUTACT04_TFS,Future Act: Change career choice,1,1,1,1,1,1,1,1,1,1,1,1,1,1,1,1,1,1,1,1,1,1,1,1,1,1,1,1,0,0
FUTACT05_TFS,Future Act: Change major field,1,1,1,1,1,1,1,1,1,1,1,1,1,1,1,1,1,0,1,1,0,0,0,0,0,0,0,0,0,0
FUTACT06_TFS,Future Act: Communicate regularly with your professors,0,1,1,1,1,1,1,1,1,0,0,0,0,0,0,0,0,0,0,0,0,0,0,0,0,0,0,0,0,0
FUTACT07_TFS,Future Act: Discuss course content with students outside of class,0,0,0,0,0,0,0,0,0,0,0,0,0,1,1,1,1,1,1,1,1,1,1,1,1,1,1,0,0,0
FUTACT08_TFS,Future Act: Drop out of this college temporarily (exclude transferring),0,0,0,0,0,0,0,0,0,0,0,0,0,1,1,1,1,1,1,1,1,1,1,1,1,1,1,0,0,0
FUTACT09_TFS,Future Act: Drop out permanently (exclude transferring),0,0,0,0,0,0,0,0,0,0,0,0,0,0,1,1,1,1,1,1,1,1,1,1,1,1,1,0,0,0
FUTACT10_TFS,Future Act: Fail one or more courses,0,0,0,0,0,0,0,0,0,0,0,1,1,1,1,1,1,1,1,1,1,1,1,1,1,1,1,0,0,0
FUTACT11_TFS,"Future Act: Get a bachelor's degree (B.A., B.S., etc.)",1,1,1,1,1,1,1,1,1,1,1,1,1,1,1,1,1,1,1,1,1,1,1,1,1,1,1,1,1,1
FUTACT12_TFS,Future Act: Get a job to help pay for college expenses,0,0,0,0,0,0,0,0,0,0,0,0,0,0,1,1,1,1,1,1,1,1,1,1,1,1,1,0,0,0
FUTACT13_TFS,Future Act: Get married while in college,1,0,1,0,1,0,1,1,1,0,0,0,0,0,0,0,0,0,0,0,0,0,1,1,1,1,1,1,0,0
FUTACT14_TFS,Future Act: Get tutoring help in specific courses,0,0,0,0,0,0,0,0,0,0,0,0,0,1,1,1,1,1,1,1,1,1,1,1,1,1,1,1,0,0
FUTACT15_TFS,Future Act: Graduate with honors,0,1,1,1,1,1,1,1,1,1,0,0,0,0,0,0,0,0,0,0,0,0,0,0,0,0,0,0,0,0
FUTACT16_TFS,Future Act: Have a roommate of different race/ethnicity,1,1,1,1,1,1,1,1,1,1,1,1,1,1,1,1,1,0,1,1,0,0,0,0,0,0,0,0,0,0
FUTACT17_TFS,Future Act: Join a social fraternity or sorority,0,0,0,0,0,0,0,0,0,0,0,0,0,0,1,1,1,1,1,1,1,1,1,1,1,1,1,0,0,0
FUTACT18_TFS,"Future Act: Join a social fraternity, sorority, or club",0,1,1,1,1,1,1,1,1,1,1,1,1,1,1,1,1,1,1,1,1,1,1,1,1,1,1,0,0,0
FUTACT19_TFS,Future Act: Make at least a 'B' average,0,0,1,1,1,1,1,1,1,1,1,0,0,1,1,1,1,1,1,1,1,1,1,1,1,1,1,0,0,0
FUTACT20_TFS,Future Act: Need extra time to complete your degree requirements,1,1,1,1,1,1,1,1,1,1,1,1,1,1,1,1,1,0,0,0,0,0,0,0,0,0,0,0,0,0
FUTACT21_TFS,Future Act: Participate in a study abroad program,1,1,1,1,1,1,1,1,1,1,1,1,1,1,1,1,1,0,1,1,0,0,0,0,0,0,0,0,0,0
FUTACT22_TFS,Future Act: Participate in student clubs/groups,1,1,1,1,1,1,1,1,1,1,1,1,1,1,1,1,1,0,1,1,0,0,0,0,0,0,0,0,0,0
FUTACT23_TFS,Future Act: Participate in student government,0,1,1,1,1,1,1,1,1,1,1,1,1,1,1,1,1,1,1,1,1,1,1,1,1,1,1,0,0,0
FUTACT24_TFS,Future Act: Participate in student protests or demonstrations,1,1,1,1,1,1,1,1,1,1,1,1,1,1,1,1,1,1,1,1,1,1,1,1,1,1,1,0,0,0
FUTACT25_TFS,Future Act: Participate in volunteer or community service work,0,1,1,1,1,1,1,1,0,0,0,0,0,0,0,0,0,0,0,0,0,0,0,0,0,0,0,0,0,0
FUTACT26_TFS,"Future Act: Play club, intramural, or recreational sports",0,1,1,1,1,1,1,1,0,0,0,0,0,0,0,0,0,0,0,0,0,0,0,0,0,0,0,0,0,0
FUTACT27_TFS,Future Act: Play intercollegiate athletics (e.g. NCAA or NAIA-sponsored),0,0,0,0,0,0,1,1,1,1,1,1,1,1,1,1,1,1,1,1,1,1,1,1,1,1,1,0,0,0
FUTACT28_TFS,Future Act: Play varsity/intercollegiate athletics,1,1,1,1,1,1,1,1,1,1,1,1,1,1,1,1,1,1,1,1,1,0,1,1,0,1,1,0,0,0
FUTACT29_TFS,Future Act: Seek personal counseling,0,1,1,1,1,1,1,1,1,1,1,1,1,1,1,1,1,0,1,1,0,0,0,0,0,0,0,0,0,0
FUTACT30_TFS,Future Act: Socialize with someone of another racial/ethnic group,1,1,1,0,1,1,1,0,0,0,0,0,0,0,0,0,0,0,0,0,0,0,0,0,0,0,0,0,0,0
FUTACT31_TFS,Future Act: Take courses from more than one college simultaneously,1,1,1,1,1,1,1,1,1,1,1,1,1,1,1,1,1,1,1,1,1,1,1,1,1,1,1,0,0,0
FUTACT32_TFS,Future Act: Transfer to another college before graduating,0,1,1,1,1,1,1,1,1,1,1,1,1,1,1,1,1,1,1,1,1,1,1,1,1,1,1,0,0,0
FUTACT33_TFS,Future Act: Work full-time while attending college,1,1,1,1,1,1,1,1,1,0,0,0,0,0,0,0,0,0,0,0,0,0,0,0,0,0,0,0,0,0
FUTACT34_TFS,Future Act: Work on a professor's research project,1,1,1,0,1,0,0,0,0,0,0,0,0,0,0,0,0,0,0,0,0,0,0,0,0,0,0,0,0,0
FUTACT35_TFS,Future Act: Take a leave of absence from this college temporarily,0,1,1,0,0,0,0,0,0,0,0,0,0,0,0,0,0,0,0,0,0,0,0,0,0,0,0,0,0,0
FUTACT36_TFS,Future Act: Take a course exclusively online at this institution,0,1,1,0,0,0,0,0,0,0,0,0,0,0,0,0,0,0,0,0,0,0,0,0,0,0,0,0,0,0
FUTACT37_TFS,Future Act: Take a course exclusively online at a different institution,1,1,1,0,0,0,0,0,0,0,0,0,0,0,0,0,0,0,0,0,0,0,0,0,0,0,0,0,0,0
FUTACT38_TFS,"Future Act: Vote in a local, state, or national election",1,0,0,0,0,0,0,0,0,0,0,0,0,0,0,0,0,0,0,0,0,0,0,0,0,0,0,0,0,0
FUTACT39_TFS,Future Act: Take a course exclusively online,0,0,1,1,1,1,1,1,1,0,0,0,0,0,0,0,0,0,0,0,0,0,0,0,0,0,0,0,0,0
GOAL01_TFS,Goal: Adopting 'green' practices to protect the environment,1,1,1,1,1,1,1,1,1,1,1,1,1,1,1,1,1,1,1,1,1,1,1,1,1,1,1,0,0,0
GOAL02_TFS,Goal: Becoming a community leader,1,1,1,1,1,1,1,1,1,1,1,1,1,1,1,1,1,1,1,1,1,1,1,1,1,1,1,0,0,0
GOAL03_TFS,"Goal: Becoming accomplished in one of the performing arts (acting, dancing, etc.)",1,1,1,1,1,1,1,1,1,1,1,1,1,1,1,1,1,1,1,1,1,1,1,1,1,1,1,0,0,0
GOAL04_T2_TFS,Goal: Never being obligated to people,0,0,0,0,0,0,0,0,0,0,0,0,0,0,0,0,0,0,0,0,0,0,0,0,0,0,1,0,0,0
GOAL04_TFS,Goal: Becoming an authority in my field,0,0,0,0,0,0,0,0,0,0,0,0,0,0,0,0,0,0,0,0,0,0,0,0,0,0,1,0,0,0
GOAL05_T2_TFS,Goal: Raising a family,0,0,0,0,0,0,0,0,0,0,0,0,0,0,0,0,0,0,0,0,0,0,0,0,0,1,1,0,0,0
GOAL05_TFS,Goal: Becoming an expert in finance and commerce,1,1,1,1,1,1,1,1,1,1,1,1,1,1,1,1,1,1,1,1,1,1,1,1,1,1,1,0,0,0
GOAL06_TFS,Goal: Becoming involved in programs to clean up the environment,1,1,1,1,1,1,1,1,1,1,1,1,1,1,1,1,1,1,1,1,1,1,1,1,1,1,1,1,1,1
GOAL07_TFS,Goal: Becoming successful in a business of my own,1,1,1,1,1,1,1,1,1,1,1,1,1,1,1,1,1,1,1,1,1,1,1,1,1,1,1,1,1,1
GOAL08_TFS,Goal: Being very well off financially,1,1,1,1,1,1,1,1,1,1,1,1,1,1,1,1,1,1,1,1,1,1,1,1,1,1,1,1,1,1
GOAL09_TFS,"Goal: Creating artistic work (painting, sculpture, etc.)",1,1,1,1,1,1,1,1,1,1,1,1,1,1,1,1,1,1,1,1,1,1,1,1,1,1,1,1,1,1
GOAL10_TFS,Goal: Developing a meaningful philosophy of life,0,0,0,0,0,0,0,1,1,1,1,1,1,1,1,1,1,1,1,1,1,1,1,1,1,1,1,1,1,1
GOAL11_TFS,Goal: Having administrative responsibility for the work of others,1,1,1,1,1,1,1,1,1,1,1,1,1,1,1,1,1,1,1,1,1,1,1,1,1,1,1,1,1,1
GOAL12_TFS,Goal: Helping others who are in difficulty,1,1,1,1,1,1,1,1,1,1,1,1,1,1,1,1,1,1,1,1,1,1,1,1,1,1,1,1,1,1
